{
  "$schema": "https://json-schema.org/draft/2020-12/schema",
  "$id": "innerbloom://marketing/campaign-draft-v1",
  "title": "Innerbloom Campaign Draft v1",
  "type": "object",
  "additionalProperties": false,
  "required": ["schema_version", "agent", "period_key", "generated_at", "provenance", "campaign", "campaign_execution_summary", "posts", "asset_requirements", "campaign_quality_report", "source_manifest"],
  "properties": {
    "schema_version": {"const": "1.0"},
    "agent": {"const": "innerbloom_head_of_content"},
    "period_key": {"$ref": "#/$defs/periodKey"},
    "generated_at": {"type": "string", "format": "date-time"},
    "provenance": {
      "type": "object",
      "additionalProperties": false,
      "required": ["source_branch", "content_context_path", "content_context_sha256", "cmo_strategy_path", "cmo_strategy_sha256", "head_of_content_contract_version"],
      "properties": {
        "source_branch": {"type": "string", "pattern": "^automation/marketing-cycle-\\d{4}-\\d{2}$"},
        "content_context_path": {"type": "string", "pattern": "^marketing/agent-inputs/\\d{4}-\\d{2}/content-context\\.json$"},
        "content_context_sha256": {"$ref": "#/$defs/sha256"},
        "cmo_strategy_path": {"type": "string", "pattern": "^marketing/agent-outputs/\\d{4}-\\d{2}/cmo-strategy\\.json$"},
        "cmo_strategy_sha256": {"$ref": "#/$defs/sha256"},
        "head_of_content_contract_version": {"const": "campaign-draft-v1"}
      }
    },
    "campaign": {
      "type": "object",
      "additionalProperties": false,
      "required": ["campaign_code", "title", "objective", "status", "strategy_summary", "language", "platforms", "formats", "target_post_count", "timezone", "publishing_start_date", "publishing_end_date"],
      "properties": {
        "campaign_code": {"type": "string", "pattern": "^[A-Za-z0-9_-]+$"},
        "title": {"type": "string", "minLength": 1},
        "objective": {"enum": ["new_users", "leads", "activation", "awareness", "retention"]},
        "status": {"const": "review"},
        "strategy_summary": {"type": "string", "minLength": 1},
        "language": {"type": "string", "minLength": 1},
        "platforms": {"type": "array", "minItems": 1, "uniqueItems": true, "items": {"type": "string", "minLength": 1}},
        "formats": {"type": "array", "minItems": 1, "uniqueItems": true, "items": {"$ref": "#/$defs/format"}},
        "target_post_count": {"type": "integer", "minimum": 1, "maximum": 100},
        "timezone": {"type": "string", "minLength": 1},
        "publishing_start_date": {"type": "string", "format": "date"},
        "publishing_end_date": {"type": "string", "format": "date"}
      }
    },
    "campaign_execution_summary": {
      "type": "object",
      "additionalProperties": false,
      "required": ["post_count", "format_counts", "pillar_counts", "funnel_counts", "asset_slot_count"],
      "properties": {
        "post_count": {"type": "integer", "minimum": 1},
        "format_counts": {"$ref": "#/$defs/countMap"},
        "pillar_counts": {"$ref": "#/$defs/countMap"},
        "funnel_counts": {"$ref": "#/$defs/countMap"},
        "asset_slot_count": {"type": "integer", "minimum": 1},
        "notes": {"type": "array", "items": {"type": "string", "minLength": 1}}
      }
    },
    "posts": {
      "type": "array",
      "minItems": 1,
      "items": {"$ref": "#/$defs/post"}
    },
    "asset_requirements": {
      "type": "array",
      "items": {"$ref": "#/$defs/assetRequirement"}
    },
    "campaign_quality_report": {
      "type": "object",
      "additionalProperties": false,
      "required": ["schema_ready", "strategy_fidelity", "claim_safety", "tracking_integrity", "calendar_integrity", "editorial_diversity", "visual_brief_completeness", "known_risks"],
      "properties": {
        "schema_ready": {"type": "boolean"},
        "strategy_fidelity": {"type": "boolean"},
        "claim_safety": {"type": "boolean"},
        "tracking_integrity": {"type": "boolean"},
        "calendar_integrity": {"type": "boolean"},
        "editorial_diversity": {"type": "boolean"},
        "visual_brief_completeness": {"type": "boolean"},
        "known_risks": {"type": "array", "items": {"type": "string", "minLength": 1}}
      }
    },
    "source_manifest": {"type": "array", "minItems": 1, "items": {"type": "object"}}
  },
  "$defs": {
    "periodKey": {"type": "string", "pattern": "^\\d{4}-(0[1-9]|1[0-2])$"},
    "sha256": {"type": "string", "pattern": "^sha256:[a-f0-9]{64}$"},
    "format": {"enum": ["static", "carousel", "reel", "story", "thread", "short_video"]},
    "countMap": {"type": "object", "additionalProperties": {"type": "integer", "minimum": 0}},
    "visibleCopy": {
      "type": "object",
      "additionalProperties": false,
      "required": ["headline"],
      "properties": {
        "headline": {"type": "string", "minLength": 1},
        "supporting_text": {"type": ["string", "null"]}
      }
    },
    "cta": {
      "type": "object",
      "additionalProperties": false,
      "required": ["label", "intent", "destination", "truthfulness_note"],
      "properties": {
        "label": {"type": "string", "minLength": 1},
        "intent": {"type": "string", "minLength": 1},
        "destination": {"type": ["string", "null"], "format": "uri"},
        "truthfulness_note": {"type": "string", "minLength": 1}
      }
    },
    "utm": {
      "type": "object",
      "additionalProperties": false,
      "required": ["utm_source", "utm_medium", "utm_campaign", "utm_content", "ib_post"],
      "properties": {
        "utm_source": {"type": "string", "minLength": 1},
        "utm_medium": {"type": "string", "minLength": 1},
        "utm_campaign": {"type": "string", "minLength": 1},
        "utm_content": {"type": "string", "minLength": 1},
        "ib_post": {"type": "string", "minLength": 1}
      }
    },
    "visualStrategy": {
      "type": "object",
      "additionalProperties": false,
      "required": ["visual_goal", "proof_type", "product_evidence", "screenshot_requirement", "informational_hierarchy", "editorial_character", "truthful_transformations", "forbidden_uses", "acceptance_criteria"],
      "properties": {
        "visual_goal": {"type": "string", "minLength": 1},
        "proof_type": {"enum": ["product", "editorial", "hybrid"]},
        "product_evidence": {"type": "array", "items": {"type": "string", "minLength": 1}},
        "screenshot_requirement": {"enum": ["required", "optional", "forbidden"]},
        "informational_hierarchy": {"type": "array", "minItems": 1, "items": {"type": "string", "minLength": 1}},
        "editorial_character": {"type": "array", "minItems": 1, "items": {"type": "string", "minLength": 1}},
        "preferred_mode": {"enum": ["dark", "light", "either"]},
        "truthful_transformations": {"type": "array", "items": {"type": "string", "minLength": 1}},
        "forbidden_uses": {"type": "array", "minItems": 1, "items": {"type": "string", "minLength": 1}},
        "acceptance_criteria": {"type": "array", "minItems": 1, "items": {"type": "string", "minLength": 1}}
      }
    },
    "assetSlot": {
      "type": "object",
      "additionalProperties": false,
      "required": ["asset_code", "post_code", "asset_kind", "semantic_purpose", "product_evidence_requirement", "existing_sources_preferred", "new_binary_may_be_required", "alt_text", "acceptance_criteria"],
      "properties": {
        "asset_code": {"type": "string", "pattern": "^[A-Za-z0-9_-]+$"},
        "post_code": {"type": "string", "pattern": "^[A-Za-z0-9_-]+$"},
        "asset_kind": {"enum": ["static", "carousel_slide", "reel_cover", "story_frame", "thread_visual", "short_video_cover"]},
        "slide_number": {"type": "integer", "minimum": 1},
        "semantic_purpose": {"type": "string", "minLength": 1},
        "product_evidence_requirement": {"type": "string", "minLength": 1},
        "existing_sources_preferred": {"type": "boolean"},
        "semantic_source_references": {"type": "array", "items": {"type": "string", "minLength": 1}},
        "new_binary_may_be_required": {"type": "boolean"},
        "alt_text": {"type": "string", "minLength": 1},
        "acceptance_criteria": {"type": "array", "minItems": 1, "items": {"type": "string", "minLength": 1}}
      }
    },
    "carouselSlide": {
      "type": "object",
      "additionalProperties": false,
      "required": ["slide_number", "narrative_role", "visible_copy", "product_truth_anchor", "visual_proof_requirement", "asset_code", "acceptance_criteria"],
      "properties": {
        "slide_number": {"type": "integer", "minimum": 1},
        "narrative_role": {"type": "string", "minLength": 1},
        "visible_copy": {"$ref": "#/$defs/visibleCopy"},
        "product_truth_anchor": {"type": "string", "minLength": 1},
        "visual_proof_requirement": {"type": "string", "minLength": 1},
        "asset_code": {"type": "string", "pattern": "^[A-Za-z0-9_-]+$"},
        "acceptance_criteria": {"type": "array", "minItems": 1, "items": {"type": "string", "minLength": 1}}
      }
    },
    "carousel": {
      "type": "object",
      "additionalProperties": false,
      "required": ["slide_count", "narrative_arc", "slides"],
      "properties": {
        "slide_count": {"type": "integer", "minimum": 2, "maximum": 20},
        "narrative_arc": {"type": "string", "minLength": 1},
        "slides": {"type": "array", "minItems": 2, "items": {"$ref": "#/$defs/carouselSlide"}}
      }
    },
    "post": {
      "type": "object",
      "additionalProperties": false,
      "required": ["post_code", "sequence_number", "platform", "format", "status", "scheduled_at", "content_pillar", "funnel_stage", "experiment_code", "audience_tension", "product_truth_anchor", "hook", "caption", "cta", "hypothesis", "primary_metric", "tracking_url", "utm", "visible_copy_plan", "visual_strategy", "accessibility", "asset_slots"],
      "properties": {
        "post_code": {"type": "string", "pattern": "^[A-Za-z0-9_-]+$"},
        "sequence_number": {"type": "integer", "minimum": 1},
        "platform": {"type": "string", "minLength": 1},
        "format": {"$ref": "#/$defs/format"},
        "status": {"const": "needs_review"},
        "scheduled_at": {"type": "string", "format": "date-time"},
        "content_pillar": {"type": "string", "minLength": 1},
        "funnel_stage": {"type": "string", "minLength": 1},
        "experiment_code": {"type": "string", "minLength": 1},
        "audience_tension": {"type": "string", "minLength": 1},
        "product_truth_anchor": {"type": "string", "minLength": 1},
        "hook": {"type": "string", "minLength": 1},
        "caption": {"type": "string", "minLength": 1},
        "cta": {"$ref": "#/$defs/cta"},
        "hypothesis": {"type": "string", "minLength": 1},
        "primary_metric": {"type": "string", "minLength": 1},
        "tracking_url": {"type": ["string", "null"], "format": "uri"},
        "utm": {"$ref": "#/$defs/utm"},
        "visible_copy_plan": {"$ref": "#/$defs/visibleCopy"},
        "visual_strategy": {"$ref": "#/$defs/visualStrategy"},
        "accessibility": {
          "type": "object",
          "additionalProperties": false,
          "required": ["alt_text", "readability_note"],
          "properties": {
            "alt_text": {"type": "string", "minLength": 1},
            "readability_note": {"type": "string", "minLength": 1}
          }
        },
        "asset_slots": {"type": "array", "minItems": 1, "items": {"$ref": "#/$defs/assetSlot"}},
        "carousel": {"$ref": "#/$defs/carousel"}
      },
      "allOf": [
        {"if": {"properties": {"format": {"const": "carousel"}}}, "then": {"required": ["carousel"]}, "else": {"not": {"required": ["carousel"]}}}
      ]
    },
    "assetRequirement": {
      "type": "object",
      "additionalProperties": false,
      "required": ["requirement_code", "kind", "related_asset_codes", "related_post_codes", "priority", "semantic_source_references", "production_brief", "truthfulness_constraints", "acceptance_criteria"],
      "properties": {
        "requirement_code": {"type": "string", "pattern": "^[A-Za-z0-9_-]+$"},
        "kind": {"enum": ["reuse_existing_source", "edit_existing_source", "compose_existing_sources", "new_source_required"]},
        "related_asset_codes": {"type": "array", "minItems": 1, "uniqueItems": true, "items": {"type": "string"}},
        "related_post_codes": {"type": "array", "minItems": 1, "uniqueItems": true, "items": {"type": "string"}},
        "priority": {"enum": ["high", "medium", "low"]},
        "semantic_source_references": {"type": "array", "items": {"type": "string", "minLength": 1}},
        "production_brief": {"type": "string", "minLength": 1},
        "truthfulness_constraints": {"type": "array", "minItems": 1, "items": {"type": "string", "minLength": 1}},
        "acceptance_criteria": {"type": "array", "minItems": 1, "items": {"type": "string", "minLength": 1}}
      }
    }
  }
}
